{
  "schema_version": "0.1.0",
  "session_id": "attempts-3-session",
  "synthetic": true,
  "engine_version": "authored-fixture",
  "environment": {
    "mode": "unknown",
    "detection": "unverified",
    "asserted_mode": null,
    "attestation": "not_performed",
    "evidence": []
  },
  "device_catalog": {
    "devices": [
      {
        "device_id": "dev-1",
        "name": "testdev0",
        "driver": "synthetic-test",
        "identity_status": "resolved"
      }
    ]
  },
  "capabilities": {
    "bounce_attempts": {"status": "verified", "grade": null, "reason": "Fictional successful state for analyzer tests; this session is synthetic."},
    "mapping_lifecycle": {"status": "unavailable", "grade": null, "reason": "No map_result source in this fixture."},
    "copy_bytes": {"status": "unavailable", "grade": null, "reason": "No copy source in this fixture."},
    "sync_requests": {"status": "unavailable", "grade": null, "reason": "No sync source in this fixture."},
    "conversion_results": {"status": "unavailable", "grade": null, "reason": "No conversion source in this fixture."},
    "region_state": {"status": "unavailable", "grade": null, "reason": "No region source in this fixture."},
    "pool_stats": {"status": "unavailable", "grade": null, "reason": "No pool source in this fixture."},
    "task_context": {"status": "unavailable", "grade": null, "reason": "No observer context in this fixture."}
  },
  "quality": {
    "detail": {
      "status": "complete_for_scope",
      "loss_count": "0",
      "scope": "3 bounce_attempt events",
      "reason": "Authored fixture: no loss."
    },
    "aggregate": {
      "status": "unavailable",
      "loss_count": null,
      "scope": "counter snapshots",
      "reason": "No counter snapshots in this fixture."
    },
    "correlation": {
      "status": "complete_for_scope",
      "loss_count": "0",
      "scope": "attempt counting",
      "reason": "Attempt counting needs no cross-event correlation."
    },
    "baseline": {
      "status": "not_applicable",
      "loss_count": null,
      "scope": "attempt metrics",
      "reason": "Attempt metrics need no baseline."
    },
    "terminal": {
      "status": "complete_for_scope",
      "loss_count": "0",
      "scope": "authored fixture finalization",
      "reason": "Authored fixture: finalized."
    }
  },
  "metrics": [
    {
      "name": "bounce_attempts",
      "value": "3",
      "unit": "count",
      "measurement": "observed",
      "coverage": "complete_for_scope",
      "confidence": "high",
      "aggregation": "counter",
      "sample_count": null,
      "dimensions": {"device_id": null, "pool_id": null},
      "scope": "window [1000000000,4000000000), all devices, detail channel",
      "notes": "3 detail events; no counter snapshots to compare."
    },
    {
      "name": "bounce_attempts",
      "value": "3",
      "unit": "count",
      "measurement": "observed",
      "coverage": "complete_for_scope",
      "confidence": "high",
      "aggregation": "counter",
      "sample_count": null,
      "dimensions": {"device_id": "dev-1", "pool_id": null},
      "scope": "window [1000000000,4000000000), device dev-1, detail channel",
      "notes": "All 3 attempts observed device dev-1."
    },
    {
      "name": "requested_bounce_bytes",
      "value": "9216",
      "unit": "bytes",
      "measurement": "observed",
      "coverage": "complete_for_scope",
      "confidence": "high",
      "aggregation": "counter",
      "sample_count": null,
      "dimensions": {"device_id": null, "pool_id": null},
      "scope": "window [1000000000,4000000000), all devices, detail channel",
      "notes": "4096 + 4096 + 1024 requested bytes across 3 attempts; allocation outcomes are unavailable in this fixture."
    },
    {
      "name": "requested_bounce_bytes",
      "value": "9216",
      "unit": "bytes",
      "measurement": "observed",
      "coverage": "complete_for_scope",
      "confidence": "high",
      "aggregation": "counter",
      "sample_count": null,
      "dimensions": {"device_id": "dev-1", "pool_id": null},
      "scope": "window [1000000000,4000000000), device dev-1, detail channel",
      "notes": "4096 + 4096 + 1024 requested bytes on device dev-1."
    },
    {
      "name": "successful_allocations",
      "value": null,
      "unit": "count",
      "measurement": "unavailable",
      "coverage": "unavailable",
      "confidence": "high",
      "aggregation": null,
      "sample_count": null,
      "dimensions": {"device_id": null, "pool_id": null},
      "scope": "window [1000000000,4000000000), all devices",
      "notes": "No map_result source in this fixture; attempts are not successes."
    },
    {
      "name": "copy_original_to_bounce_bytes",
      "value": null,
      "unit": "bytes",
      "measurement": "unavailable",
      "coverage": "unavailable",
      "confidence": "high",
      "aggregation": null,
      "sample_count": null,
      "dimensions": {"device_id": null, "pool_id": null},
      "scope": "window [1000000000,4000000000), all devices",
      "notes": "No copy source in this fixture."
    },
    {
      "name": "copy_bounce_to_original_bytes",
      "value": null,
      "unit": "bytes",
      "measurement": "unavailable",
      "coverage": "unavailable",
      "confidence": "high",
      "aggregation": null,
      "sample_count": null,
      "dimensions": {"device_id": null, "pool_id": null},
      "scope": "window [1000000000,4000000000), all devices",
      "notes": "No copy source in this fixture."
    },
    {
      "name": "live_observed_allocation_bytes",
      "value": null,
      "unit": "bytes",
      "measurement": "unavailable",
      "coverage": "unavailable",
      "confidence": "high",
      "aggregation": null,
      "sample_count": null,
      "dimensions": {"device_id": null, "pool_id": null},
      "scope": "window [1000000000,4000000000), all devices",
      "notes": "No lifecycle source in this fixture."
    },
    {
      "name": "observed_mapping_lifetime_ns",
      "value": null,
      "unit": "nanoseconds",
      "measurement": "unavailable",
      "coverage": "unavailable",
      "confidence": "high",
      "aggregation": null,
      "sample_count": null,
      "dimensions": {"device_id": null, "pool_id": null},
      "scope": "window [1000000000,4000000000), all devices",
      "notes": "No lifecycle source in this fixture."
    },
    {
      "name": "conversion_request_bytes",
      "value": null,
      "unit": "bytes",
      "measurement": "unavailable",
      "coverage": "unavailable",
      "confidence": "high",
      "aggregation": null,
      "sample_count": null,
      "dimensions": {"device_id": null, "pool_id": null},
      "scope": "window [1000000000,4000000000)",
      "notes": "No conversion source in this fixture."
    },
    {
      "name": "known_shared_region_bytes",
      "value": null,
      "unit": "bytes",
      "measurement": "unavailable",
      "coverage": "unavailable",
      "confidence": "medium",
      "aggregation": null,
      "sample_count": null,
      "dimensions": {"device_id": null, "pool_id": null},
      "scope": "window [1000000000,4000000000)",
      "notes": "No region source in this fixture."
    },
    {
      "name": "pool_used_bytes",
      "value": null,
      "unit": "bytes",
      "measurement": "unavailable",
      "coverage": "unavailable",
      "confidence": "high",
      "aggregation": null,
      "sample_count": null,
      "dimensions": {"device_id": null, "pool_id": null},
      "scope": "window [1000000000,4000000000)",
      "notes": "No pool source in this fixture."
    },
    {
      "name": "pool_capacity_bytes",
      "value": null,
      "unit": "bytes",
      "measurement": "unavailable",
      "coverage": "unavailable",
      "confidence": "high",
      "aggregation": null,
      "sample_count": null,
      "dimensions": {"device_id": null, "pool_id": null},
      "scope": "window [1000000000,4000000000)",
      "notes": "No pool source in this fixture."
    },
    {
      "name": "pool_hiwater_bytes",
      "value": null,
      "unit": "bytes",
      "measurement": "unavailable",
      "coverage": "unavailable",
      "confidence": "high",
      "aggregation": null,
      "sample_count": null,
      "dimensions": {"device_id": null, "pool_id": null},
      "scope": "window [1000000000,4000000000)",
      "notes": "No pool source in this fixture."
    }
  ],
  "findings": [],
  "limitations": [
    "Synthetic fixture: every value is authored test data; no guest was booted and no hook attached.",
    "Lifecycle, copy, region, and pool metrics are unavailable: the fixture carries bounce attempts only.",
    "No counter snapshots: attempt totals rest on the detail channel alone."
  ]
}
